{
  "$schema": "./module-map.schema.json",
  "schema_version": 2,
  "current_context": {
    "files_read": [
      "AGENTS.md"
    ]
  },
  "defaults": {
    "max_files": 7,
    "max_estimated_tokens": 16000,
    "max_routes": 1,
    "max_adrs": 3,
    "max_tests": 4
  },
  "coverage": {
    "roots": [
      "src/main",
      "src/renderer",
      "src/preload",
      "src/shared",
      "ai-service"
    ],
    "extensions": [
      ".ts",
      ".tsx",
      ".js",
      ".mjs",
      ".py"
    ],
    "exclude": [
      "src/main/extensions/photoshow/**",
      "src/renderer/routes/refactor-prototype/**",
      "src/renderer/routes/work-mode-prototype/**",
      "**/tests/**",
      "**/*.test.ts",
      "**/*.test.tsx",
      "ai-service/eval/datasets/**",
      "ai-service/eval/reports/**"
    ]
  },
  "modules": {
    "electron-main": {
      "purpose": "Electron composition, trusted local capabilities, IPC and product orchestration outside the isolated intake, lifecycle and Model Library tracers.",
      "owns": [
        "src/main/**"
      ],
      "exclude": [
        "src/main/capture-intake/**",
        "src/main/library-lifecycle/**",
        "src/main/model-library/**",
        "src/main/extensions/photoshow/**"
      ],
      "readme": "src/main/README.md"
    },
    "capture-intake": {
      "purpose": "Safe Copy planning, Candidate identity, Promotion and persistence adapters for the isolated intake tracer.",
      "owns": [
        "src/main/capture-intake/**"
      ],
      "readme": "src/main/capture-intake/README.md"
    },
    "library-lifecycle": {
      "purpose": "Read-only Library opening/creation planning, Manifest/filesystem evidence, Exclusive Lock, Active Library authority and Asset Trash tracers.",
      "owns": [
        "src/main/library-lifecycle/**"
      ],
      "readme": "src/main/library-lifecycle/README.md"
    },
    "model-library": {
      "purpose": "Path-free Model Library Interfaces and isolated signed admission, verified storage, root authority and device-local current-root Registry tracers; no production install authority.",
      "owns": [
        "src/main/model-library/**"
      ],
      "readme": "src/main/model-library/README.md"
    },
    "renderer": {
      "purpose": "React product surfaces, interaction state and adapters to the Preload bridge.",
      "owns": [
        "src/renderer/**"
      ],
      "readme": "src/renderer/README.md"
    },
    "preload": {
      "purpose": "Narrow trusted bridge between Renderer and Electron Main.",
      "owns": [
        "src/preload/**"
      ]
    },
    "shared": {
      "purpose": "Cross-process contracts, types, constants and pure workflow projections.",
      "owns": [
        "src/shared/**"
      ],
      "readme": "src/shared/README.md"
    },
    "ai-worker": {
      "purpose": "Python inference worker, model adapters, queues, evaluation tools and worker-owned task state.",
      "owns": [
        "ai-service/**"
      ],
      "readme": "ai-service/README.md"
    }
  },
  "routes": {
    "asset-workspace": {
      "summary": "Asset Library browsing, Inspector, tags, captions, bulk actions and the primary product surface.",
      "aliases": [
        "asset workspace",
        "asset thumbnail",
        "drag into library",
        "素材工作区",
        "标签管理",
        "素材缩略图",
        "拖入素材",
        "user edit",
        "user-edited caption",
        "user-edited description",
        "用户编辑",
        "用户编辑素材描述",
        "用户编辑描述",
        "tag group",
        "bulk selection",
        "multi select",
        "library toolbar",
        "comparison tray",
        "Eagle 连接库"
      ],
      "keywords": [
        "tag",
        "标签",
        "caption",
        "inspector",
        "检查器",
        "waterfall",
        "thumbnail",
        "瀑布流",
        "bulk",
        "批量",
        "缩略图",
        "user edit",
        "Eagle",
        "同步"
      ],
      "modules": [
        "renderer",
        "electron-main",
        "preload",
        "shared"
      ],
      "states": [
        {
          "reality": "Current Implementation",
          "summary": "Formal minimal Library Canvas uses Active Library data, controlled previews, lexical search, side details and focus gallery; prototype persistence is not imported.",
          "evidence": [
            "src/renderer/routes/Library.tsx",
            "src/renderer/stores/asset.store.ts",
            "src/main/index.ts"
          ]
        },
        {
          "reality": "Target Architecture",
          "summary": "The accepted workspace grows through progressive intake, analysis and explainable discovery without making classification a gate.",
          "evidence": [
            "docs/adr/0009-asset-workspace-is-the-primary-surface.md",
            "docs/adr/0413-asset-organization-is-search-first-and-does-not-require-classification-completeness.md"
          ]
        }
      ],
      "read_first": [
        {
          "path": "src/renderer/routes/Library.tsx",
          "anchor": "export default function Library",
          "triggers": [
            "workspace",
            "library",
            "inspector",
            "素材工作区",
            "素材库",
            "检查器"
          ],
          "role": "caller",
          "reality": "Current Implementation",
          "reason": "Primary Asset Workspace composition and interaction flow.",
          "read_mode": "symbol",
          "priority": 1
        },
        {
          "path": "src/renderer/components/library/canvas/LibraryCanvas.tsx",
          "anchor": "export function LibraryCanvas",
          "triggers": [
            "card",
            "button",
            "waterfall",
            "thumbnail",
            "卡片",
            "按钮",
            "瀑布流",
            "缩略图"
          ],
          "role": "caller",
          "reality": "Current Implementation",
          "reason": "Formal gallery, bottom search, selection, library states and retained controls.",
          "read_mode": "symbol",
          "priority": 2
        },
        {
          "path": "src/renderer/stores/asset.store.ts",
          "anchor": "function mapDbAssetToAsset",
          "triggers": [
            "store",
            "state",
            "load",
            "save",
            "delete",
            "tag",
            "caption",
            "thumbnail",
            "状态",
            "加载",
            "保存",
            "删除",
            "标签",
            "描述",
            "缩略图"
          ],
          "role": "implementation",
          "reality": "Current Implementation",
          "reason": "Renderer Asset projection mapping and current Main bridge state.",
          "read_mode": "symbol",
          "priority": 3
        },
        {
          "path": "src/shared/contracts/asset.contract.ts",
          "triggers": [
            "ipc",
            "contract",
            "bridge",
            "delete",
            "保存",
            "删除"
          ],
          "role": "contract",
          "reality": "Current Implementation",
          "reason": "Shared Asset IPC Interface and compatibility seam.",
          "read_mode": "full",
          "priority": 3
        },
        {
          "path": "src/main/ipc/active-library.ipc.ts",
          "anchor": "export function registerActiveLibraryIpc",
          "triggers": [
            "ipc",
            "main",
            "bridge",
            "delete",
            "保存",
            "删除"
          ],
          "role": "adapter",
          "reality": "Current Implementation",
          "reason": "Current Active Library IPC composition and held authority; legacy Asset IPC is not this write path.",
          "read_mode": "symbol",
          "priority": 4
        },
        {
          "path": "src/renderer/components/library/README.md",
          "role": "readme",
          "reality": "Current Implementation",
          "reason": "Nearest durable Library UI behavior notes.",
          "read_mode": "full",
          "priority": 6
        },
        {
          "path": "src/main/external-connected-library/README.md",
          "triggers": [
            "Eagle",
            "connected",
            "连接库",
            "旧库"
          ],
          "role": "readme",
          "reality": "Current Implementation",
          "reason": "Connected ownership and evidence limits.",
          "read_mode": "full",
          "priority": 2
        },
        {
          "path": "src/renderer/components/library/canvas/LibraryFocus.tsx",
          "anchor": "export function LibraryFocus",
          "triggers": [
            "focus",
            "preview",
            "专注",
            "查看",
            "预览"
          ],
          "role": "implementation",
          "reality": "Current Implementation",
          "reason": "Controlled preview, read-only focus information, ordered filmstrip and keyboard/zoom behavior.",
          "read_mode": "symbol",
          "priority": 2
        }
      ],
      "test_profiles": [
        "asset_workspace",
        "external_connected_library"
      ],
      "adrs": [
        {
          "path": "docs/adr/0009-asset-workspace-is-the-primary-surface.md",
          "triggers": [
            "home",
            "首页",
            "navigation",
            "导航",
            "workspace"
          ],
          "reason": "Defines Asset Workspace as the primary surface.",
          "required_on_match": true
        },
        {
          "path": "docs/adr/0413-asset-organization-is-search-first-and-does-not-require-classification-completeness.md",
          "triggers": [
            "unsorted",
            "分类",
            "organization",
            "collection"
          ],
          "reason": "Protects search-first organization and non-blocking Unsorted state."
        }
      ],
      "avoid": [
        "Do not read the complete renderer README or all workspace ADRs for a local UI fix.",
        "Do not treat AI Console or Web Capture as the product home."
      ],
      "warnings": [